{
  "$schema": "./secret.schema.json",
  "name": "UTM Analytics Dashboard Secrets (Example)",
  "version": "1.0.0",
  "description": "민감한 환경변수 통합 관리 파일 템플릿 - 실제 값으로 변경 후 사용하세요",
  "secrets": {
    "database": {
      "NEXT_PUBLIC_SUPABASE_ANON_KEY": "your-supabase-anon-key-here"
    },
    "google_service_account": {
      "type": "service_account",
      "project_id": "your-google-project-id",
      "private_key_id": "your-private-key-id",
      "private_key": "-----BEGIN PRIVATE KEY-----\nYOUR_PRIVATE_KEY_CONTENT_HERE\n-----END PRIVATE KEY-----\n",
      "client_email": "your-service-account@your-project.iam.gserviceaccount.com",
      "client_id": "your-client-id",
      "auth_uri": "https://accounts.google.com/o/oauth2/auth",
      "token_uri": "https://oauth2.googleapis.com/token",
      "auth_provider_x509_cert_url": "https://www.googleapis.com/oauth2/v1/certs",
      "client_x509_cert_url": "https://www.googleapis.com/robot/v1/metadata/x509/your-service-account%40your-project.iam.gserviceaccount.com",
      "universe_domain": "googleapis.com"
    },
    "ai_apis": {
      "GEMINI_API_KEY": "AIzaSy...",
      "GEMINI_API_FREE_KEY": "AIzaSy... (optional backup key)"
    },
    "authentication": {
      "JWT_SECRET": "your-super-secret-jwt-key-minimum-32-characters",
      "SUPER_USER_PASSWORD": "your-secure-admin-password"
    }
  },
  "non_sensitive_config": {
    "database": {
      "DATABASE_URL": "postgresql://username:password@localhost:5432/database_name",
      "NEXT_PUBLIC_SUPABASE_URL": "https://your-project.supabase.co"
    },
    "google_analytics": {
      "GA4_PROPERTY_ID": "123456789",
      "GSC_SITE_URL": "sc-domain:your-domain.com",
      "GEMINI_API_PROJECT_ID": "your-google-cloud-project-id"
    },
    "user_info": {
      "SUPER_USER_EMAIL": "admin@your-domain.com",
      "SUPER_USER_NAME": "Your Admin Name"
    },
    "optional": {
      "NODE_ENV": "development",
      "PORT": "3000"
    }
  },
  "metadata": {
    "created_at": "2025-07-07T00:00:00Z",
    "updated_at": "2025-07-07T00:00:00Z",
    "version": "1.0.0",
    "description": "통합 시크릿 파일 템플릿 - 민감한 정보와 일반 설정을 분리하여 관리"
  },
  "instructions": {
    "how_to_use": [
      "1. 이 파일을 secret.json으로 복사하세요",
      "2. 모든 플레이스홀더 값을 실제 값으로 변경하세요",
      "3. 웹 인터페이스에서 secret.json 파일을 업로드하세요",
      "4. 또는 API를 통해 프로그래밍 방식으로 적용하세요"
    ],
    "security_notes": [
      "• secret.json 파일은 절대 Git에 커밋하지 마세요",
      "• .gitignore에 secret.json이 포함되어 있는지 확인하세요",
      "• 프로덕션 환경에서는 환경변수나 시크릿 관리 서비스를 사용하세요",
      "• 정기적으로 API 키와 비밀번호를 교체하세요"
    ],
    "file_structure": {
      "secrets": "민감한 정보 (API 키, 비밀번호, 인증 토큰 등)",
      "non_sensitive_config": "공개 가능한 설정 (URL, 이메일, 프로젝트 ID 등)",
      "metadata": "파일 정보 및 버전 관리"
    }
  }
}